{
  "schemaVersion": "4.0.0",
  "recordType": "identity_candidate",
  "recordId": "identity-example",
  "createdAt": "2026-07-24T00:00:00Z",
  "status": "PENDING",
  "provenance": {},
  "candidate": {
    "name": null,
    "dateOfBirth": null,
    "nationality": [],
    "currentTeam": null,
    "externalIds": {}
  },
  "matchScores": {},
  "conflicts": []
}
